{
  "$schema": "https://json-schema.org/draft/2020-12/schema",
  "$id": "fixture-manifest.schema.json",
  "type": "object",
  "additionalProperties": false,
  "required": ["schema_id", "version", "fixture_id", "source_class", "evidence_class", "sanitized", "captured_at", "files", "provenance"],
  "properties": {
    "schema_id": {"const": "fixture-manifest"},
    "version": {"const": "1.0.0"},
    "fixture_id": {"type": "string", "pattern": "^[a-z][a-z0-9-]{2,63}$"},
    "source_class": {"enum": ["local_client", "active_match", "static_data", "remote_account", "aggregate_statistics"]},
    "evidence_class": {"enum": ["verified-current", "observed-undocumented", "historical", "inference"]},
    "sanitized": {"const": true},
    "captured_at": {"type": "string", "format": "date-time"},
    "files": {
      "type": "array",
      "minItems": 1,
      "items": {
        "type": "object",
        "additionalProperties": false,
        "required": ["path", "sha256", "content_type"],
        "properties": {
          "path": {"type": "string", "pattern": "^(?!.*(?:^|/)\\.\\.(?:/|$))[a-zA-Z0-9_./-]+$"},
          "sha256": {"type": "string", "pattern": "^[a-f0-9]{64}$"},
          "content_type": {"enum": ["application/json", "text/plain"]}
        }
      }
    },
    "provenance": {
      "type": "object",
      "additionalProperties": false,
      "required": ["source_id", "source_url", "license_or_terms_url", "attribution"],
      "properties": {
        "source_id": {"type": "string", "pattern": "^[a-z][a-z0-9-]{2,63}$"},
        "source_url": {"type": "string", "format": "uri"},
        "license_or_terms_url": {"type": "string", "format": "uri"},
        "attribution": {"type": "string", "minLength": 3, "maxLength": 240}
      }
    },
    "review": {
      "type": "object",
      "additionalProperties": false,
      "required": ["reviewed_at", "max_age_days", "fail_age_days"],
      "properties": {
        "reviewed_at": {"type": "string", "format": "date-time"},
        "max_age_days": {"type": "integer", "minimum": 0, "maximum": 3650},
        "fail_age_days": {"type": "integer", "minimum": 1, "maximum": 3650}
      }
    }
  }
}
